{
  "image_id": 1,
  "image_file": "1.jpeg",
  "original_filename": "94776219512_20260722_182305_454115_91679266.jpeg",
  "document_type": "Daily Attendance Format",
  "confidence": 0.95,
  "date": "2026-07-21",
  "location_number": "7263",
  "location_name": "Isanandi Land",
  "shift_summary": [
    {
      "shift_name": "Day Shift",
      "scheduled_in_time": "07:00",
      "scheduled_out_time": "19:00"
    },
    {
      "shift_name": "Night Shift",
      "scheduled_in_time": "19:00",
      "scheduled_out_time": "07:00"
    }
  ],
  "attendance_records": [
    {
      "row_id": 1,
      "employee_id": "75599",
      "name": "T. Prasanna",
      "rank": "OIC",
      "working_rank": "SSO",
      "shift_type": "Day",
      "in_time": "07:00",
      "out_time": "19:00",
      "signature_present": true,
      "confidence": 0.96,
      "other": []
    },
    {
      "row_id": 2,
      "employee_id": "69663",
      "name": "B. Sivachandran",
      "rank": "SSO",
      "working_rank": "SSO",
      "shift_type": "Night",
      "in_time": "19:00",
      "out_time": "07:00",
      "signature_present": true,
      "confidence": 0.95,
      "other": []
    }
  ],
  "supervisors": [
    {
      "designation": "OIC",
      "name": "T. Prasanna",
      "employee_id": "75599",
      "signature_present": true,
      "date": null,
      "confidence": 0.94
    }
  ],
  "other": [
    {
      "key": "orientation",
      "value": "Captured rotated 180 degrees"
    }
  ]
}