{
  "image_id": 11,
  "image_file": "11.jpeg",
  "original_filename": "94775795006_20260722_121300_862832_d26675ae.jpeg",
  "document_type": "Handwritten Shift Sheet",
  "confidence": 0.98,
  "date": "2026-07-21",
  "location_number": "7336",
  "location_name": "Grand Hyatt Colombo Sri Lanka Hotel & Spa (Pvt) Ltd",
  "shift_summary": [],
  "attendance_records": [
    {
      "row_id": 1,
      "employee_id": "44059",
      "name": "N.A.B.W. Silva",
      "rank": "OIC",
      "working_rank": "OIC",
      "shift_type": "Day",
      "in_time": "07:00",
      "out_time": "19:00",
      "signature_present": true,
      "confidence": 0.98,
      "other": []
    },
    {
      "row_id": 2,
      "employee_id": "76693",
      "name": "W.M.N.P.D.B Namal Gedara",
      "rank": "SSO",
      "working_rank": "SSO",
      "shift_type": "Day",
      "in_time": "07:00",
      "out_time": "19:00",
      "signature_present": true,
      "confidence": 0.97,
      "other": []
    },
    {
      "row_id": 3,
      "employee_id": "76826",
      "name": "R.M.A.M. Rathnayake",
      "rank": "SSO",
      "working_rank": "SSO",
      "shift_type": "Day",
      "in_time": "07:00",
      "out_time": "19:00",
      "signature_present": true,
      "confidence": 0.97,
      "other": []
    },
    {
      "row_id": 4,
      "employee_id": "76527",
      "name": "B.A.J.L. Rodrigo",
      "rank": "OIC",
      "working_rank": "OIC",
      "shift_type": "Day",
      "in_time": "07:00",
      "out_time": "19:00",
      "signature_present": true,
      "confidence": 0.97,
      "other": []
    },
    {
      "row_id": 5,
      "employee_id": "44059",
      "name": "N.A.B.W. Silva",
      "rank": "OIC",
      "working_rank": "OIC",
      "shift_type": "Night",
      "in_time": "19:00",
      "out_time": "07:00",
      "signature_present": true,
      "confidence": 0.98,
      "other": []
    },
    {
      "row_id": 6,
      "employee_id": "47624",
      "name": "W.V.J. Sampath",
      "rank": "OIC",
      "working_rank": "OIC",
      "shift_type": "Night",
      "in_time": "19:00",
      "out_time": "07:00",
      "signature_present": true,
      "confidence": 0.97,
      "other": []
    },
    {
      "row_id": 7,
      "employee_id": "73441",
      "name": "K.J.I.S.K. Jagoda",
      "rank": "SSO",
      "working_rank": "SSO",
      "shift_type": "Night",
      "in_time": "19:00",
      "out_time": "07:00",
      "signature_present": true,
      "confidence": 0.97,
      "other": []
    },
    {
      "row_id": 8,
      "employee_id": "76248",
      "name": "M. Ramakrishnan",
      "rank": "SSO",
      "working_rank": "SSO",
      "shift_type": "Night",
      "in_time": "19:00",
      "out_time": "07:00",
      "signature_present": true,
      "confidence": 0.97,
      "other": []
    },
    {
      "row_id": 9,
      "employee_id": "76826",
      "name": "R.M.A.M. Rathnayake",
      "rank": "SSO",
      "working_rank": "SSO",
      "shift_type": "Night",
      "in_time": "19:00",
      "out_time": "07:00",
      "signature_present": true,
      "confidence": 0.97,
      "other": []
    },
    {
      "row_id": 10,
      "employee_id": "75915",
      "name": "P.H.C.D. Thilakasiri",
      "rank": "SSO",
      "working_rank": "SSO",
      "shift_type": "Night",
      "in_time": "19:00",
      "out_time": "07:00",
      "signature_present": true,
      "confidence": 0.97,
      "other": []
    }
  ],
  "supervisors": [
    {
      "designation": "OIC",
      "name": "N.A.B.W. Silva",
      "employee_id": "44059",
      "signature_present": true,
      "date": null,
      "confidence": 0.98
    }
  ],
  "other": []
}