{
  "image_id": 16,
  "image_file": "16.jpeg",
  "original_filename": "94743518058_20260722_115412_505797_8dc3c808.jpeg",
  "document_type": "Daily Attendance Format",
  "confidence": 0.94,
  "date": "2026-07-18",
  "location_number": "6386 A",
  "location_name": "Sofia Land",
  "shift_summary": [
    {
      "shift_name": "Day Shift",
      "scheduled_in_time": "07:00",
      "scheduled_out_time": "19:00"
    },
    {
      "shift_name": "Night Shift",
      "scheduled_in_time": "19:00",
      "scheduled_out_time": "07:00"
    }
  ],
  "attendance_records": [
    {
      "row_id": 1,
      "employee_id": "75868",
      "name": "Rajakaruna",
      "rank": "SSO",
      "working_rank": "SSO",
      "shift_type": "Day",
      "in_time": "07:00",
      "out_time": "19:00",
      "signature_present": true,
      "confidence": 0.95,
      "other": []
    },
    {
      "row_id": 2,
      "employee_id": "76916",
      "name": "Pranandu",
      "rank": "SSO",
      "working_rank": "SSO",
      "shift_type": "Day",
      "in_time": "07:00",
      "out_time": "19:00",
      "signature_present": true,
      "confidence": 0.95,
      "other": []
    },
    {
      "row_id": 3,
      "employee_id": "44665",
      "name": "Gunasekara L.P.P.",
      "rank": "OC",
      "working_rank": "SSO",
      "shift_type": "Day",
      "in_time": "07:00",
      "out_time": "19:00",
      "signature_present": true,
      "confidence": 0.94,
      "other": []
    },
    {
      "row_id": 4,
      "employee_id": "76916",
      "name": "Pranandu",
      "rank": "SSO",
      "working_rank": "SSO",
      "shift_type": "Night",
      "in_time": "19:00",
      "out_time": "07:00",
      "signature_present": true,
      "confidence": 0.95,
      "other": []
    },
    {
      "row_id": 5,
      "employee_id": "75868",
      "name": "Rajakaruna",
      "rank": "SSO",
      "working_rank": "SSO",
      "shift_type": "Night",
      "in_time": "19:00",
      "out_time": "07:00",
      "signature_present": true,
      "confidence": 0.94,
      "other": []
    },
    {
      "row_id": 6,
      "employee_id": "44665",
      "name": "Gunasekara L.P.P.",
      "rank": "OC",
      "working_rank": "SSO",
      "shift_type": "Night",
      "in_time": "19:00",
      "out_time": "07:00",
      "signature_present": true,
      "confidence": 0.94,
      "other": []
    }
  ],
  "supervisors": [
    {
      "designation": "OIC",
      "name": null,
      "employee_id": null,
      "signature_present": true,
      "date": null,
      "confidence": 0.94
    }
  ],
  "other": []
}