{
  "image_id": 7,
  "image_file": "7.jpeg",
  "original_filename": "94740835902_20260722_163112_032860_cdc88543.jpeg",
  "document_type": "Daily Attendance Sheet",
  "confidence": 0.98,
  "date": "2026-07-13",
  "location_number": "7299",
  "location_name": "Kahatagaha Graphite",
  "shift_summary": [],
  "attendance_records": [
    {
      "row_id": 1,
      "employee_id": "75936",
      "name": "W.M.E.K. Gamini",
      "rank": "OIC",
      "working_rank": "CSO",
      "shift_type": "Day",
      "in_time": "07:00",
      "out_time": "19:00",
      "signature_present": true,
      "confidence": 0.98,
      "other": []
    },
    {
      "row_id": 2,
      "employee_id": "75936",
      "name": "W.M.E.K. Gamini",
      "rank": "OIC",
      "working_rank": "CSO",
      "shift_type": "Night",
      "in_time": "19:00",
      "out_time": "07:00",
      "signature_present": true,
      "confidence": 0.98,
      "other": []
    },
    {
      "row_id": 3,
      "employee_id": "75935",
      "name": "G.R.P. Rajapaksha",
      "rank": "OIC",
      "working_rank": "OIC",
      "shift_type": "Day",
      "in_time": "07:00",
      "out_time": "19:00",
      "signature_present": true,
      "confidence": 0.98,
      "other": []
    },
    {
      "row_id": 4,
      "employee_id": "75935",
      "name": "G.R.P. Rajapaksha",
      "rank": "OIC",
      "working_rank": "OIC",
      "shift_type": "Night",
      "in_time": "19:00",
      "out_time": "07:00",
      "signature_present": true,
      "confidence": 0.98,
      "other": []
    },
    {
      "row_id": 5,
      "employee_id": "76908",
      "name": "W.A.T.N. Kumara",
      "rank": "SSO",
      "working_rank": "SSO",
      "shift_type": "Day",
      "in_time": "07:00",
      "out_time": "19:00",
      "signature_present": true,
      "confidence": 0.98,
      "other": []
    },
    {
      "row_id": 6,
      "employee_id": "76908",
      "name": "W.A.T.N. Kumara",
      "rank": "SSO",
      "working_rank": "SSO",
      "shift_type": "Night",
      "in_time": "19:00",
      "out_time": "07:00",
      "signature_present": true,
      "confidence": 0.98,
      "other": []
    },
    {
      "row_id": 7,
      "employee_id": "76379",
      "name": "K.A.S.D. Jayaweera",
      "rank": "SSO",
      "working_rank": "SSO",
      "shift_type": "Day",
      "in_time": "07:00",
      "out_time": "19:00",
      "signature_present": true,
      "confidence": 0.98,
      "other": []
    },
    {
      "row_id": 8,
      "employee_id": "76379",
      "name": "K.A.S.D. Jayaweera",
      "rank": "SSO",
      "working_rank": "SSO",
      "shift_type": "Night",
      "in_time": "19:00",
      "out_time": "07:00",
      "signature_present": true,
      "confidence": 0.98,
      "other": []
    },
    {
      "row_id": 9,
      "employee_id": "74069",
      "name": "R.M. Piyasena",
      "rank": "SSO",
      "working_rank": "SSO",
      "shift_type": "Day",
      "in_time": "07:00",
      "out_time": "19:00",
      "signature_present": true,
      "confidence": 0.98,
      "other": []
    },
    {
      "row_id": 10,
      "employee_id": "74069",
      "name": "R.M. Piyasena",
      "rank": "SSO",
      "working_rank": "SSO",
      "shift_type": "Night",
      "in_time": "19:00",
      "out_time": "07:00",
      "signature_present": true,
      "confidence": 0.98,
      "other": []
    },
    {
      "row_id": 11,
      "employee_id": "75929",
      "name": "W. Wijedasa",
      "rank": "SSO",
      "working_rank": "SSO",
      "shift_type": "Day",
      "in_time": "07:00",
      "out_time": "19:00",
      "signature_present": true,
      "confidence": 0.98,
      "other": []
    },
    {
      "row_id": 12,
      "employee_id": "75929",
      "name": "W. Wijedasa",
      "rank": "SSO",
      "working_rank": "SSO",
      "shift_type": "Night",
      "in_time": "19:00",
      "out_time": "07:00",
      "signature_present": true,
      "confidence": 0.98,
      "other": []
    },
    {
      "row_id": 13,
      "employee_id": "76627",
      "name": "D.D.D. Weerasingha",
      "rank": "SSO",
      "working_rank": "SSO",
      "shift_type": "Day",
      "in_time": "07:00",
      "out_time": "19:00",
      "signature_present": true,
      "confidence": 0.98,
      "other": []
    },
    {
      "row_id": 14,
      "employee_id": "76627",
      "name": "D.D.D. Weerasingha",
      "rank": "SSO",
      "working_rank": "SSO",
      "shift_type": "Night",
      "in_time": "19:00",
      "out_time": "07:00",
      "signature_present": true,
      "confidence": 0.98,
      "other": []
    },
    {
      "row_id": 15,
      "employee_id": "75927",
      "name": "S.M.R. Samarakoon",
      "rank": "SSO",
      "working_rank": "SSO",
      "shift_type": "Day",
      "in_time": "07:00",
      "out_time": "19:00",
      "signature_present": true,
      "confidence": 0.98,
      "other": []
    },
    {
      "row_id": 16,
      "employee_id": "75927",
      "name": "S.M.R. Samarakoon",
      "rank": "SSO",
      "working_rank": "SSO",
      "shift_type": "Night",
      "in_time": "19:00",
      "out_time": "07:00",
      "signature_present": true,
      "confidence": 0.98,
      "other": []
    },
    {
      "row_id": 17,
      "employee_id": "75932",
      "name": "R.D.R. Wijelal",
      "rank": "SSO",
      "working_rank": "SSO",
      "shift_type": "Day",
      "in_time": "07:00",
      "out_time": "19:00",
      "signature_present": true,
      "confidence": 0.98,
      "other": []
    },
    {
      "row_id": 18,
      "employee_id": "75932",
      "name": "R.D.R. Wijelal",
      "rank": "SSO",
      "working_rank": "SSO",
      "shift_type": "Night",
      "in_time": "19:00",
      "out_time": "07:00",
      "signature_present": true,
      "confidence": 0.98,
      "other": []
    }
  ],
  "supervisors": [
    {
      "designation": "OIC/CSO",
      "name": "W.M.E.K. Gamini",
      "employee_id": "75936",
      "signature_present": true,
      "date": null,
      "confidence": 0.98
    }
  ],
  "other": []
}