{
  "image_id": 5,
  "image_file": "5.jpeg",
  "original_filename": "94743518058_20260722_115428_094513_677b6acd.jpeg",
  "document_type": "Handwritten Duty Log Sheet",
  "confidence": 0.94,
  "date": "2026-07-21",
  "location_number": "9888",
  "location_name": "Hemas Dankotuwa",
  "shift_summary": [],
  "attendance_records": [
    {
      "row_id": 1,
      "employee_id": "23976",
      "name": "Nandasiri P.M.S.",
      "rank": "OIC",
      "working_rank": "OIC",
      "shift_type": "Day",
      "in_time": "07:00",
      "out_time": "19:00",
      "signature_present": true,
      "confidence": 0.95,
      "other": []
    },
    {
      "row_id": 2,
      "employee_id": "75109",
      "name": "Wittekoon W.M.R.R.K.",
      "rank": "SSO",
      "working_rank": "SSO",
      "shift_type": "Day",
      "in_time": "07:00",
      "out_time": "19:00",
      "signature_present": true,
      "confidence": 0.94,
      "other": []
    },
    {
      "row_id": 3,
      "employee_id": "76193",
      "name": "Dissanayaka D.M.S.J.",
      "rank": "LSD",
      "working_rank": "LSD",
      "shift_type": "Day",
      "in_time": "07:00",
      "out_time": "19:00",
      "signature_present": true,
      "confidence": 0.94,
      "other": []
    },
    {
      "row_id": 4,
      "employee_id": "72825",
      "name": "Rathnayaka S.M.",
      "rank": "OIC",
      "working_rank": "SSO",
      "shift_type": "Day",
      "in_time": "07:00",
      "out_time": "19:00",
      "signature_present": true,
      "confidence": 0.93,
      "other": []
    },
    {
      "row_id": 5,
      "employee_id": "75891",
      "name": "Hahanthan T.M.S.",
      "rank": "LSD",
      "working_rank": "LSD",
      "shift_type": "Day",
      "in_time": "07:00",
      "out_time": "19:00",
      "signature_present": true,
      "confidence": 0.93,
      "other": []
    },
    {
      "row_id": 6,
      "employee_id": "73088",
      "name": "Jayathilaka R.M.",
      "rank": "SSO",
      "working_rank": "SSO",
      "shift_type": "Day",
      "in_time": "07:00",
      "out_time": "19:00",
      "signature_present": true,
      "confidence": 0.95,
      "other": []
    },
    {
      "row_id": 7,
      "employee_id": "72645",
      "name": "Hewasingha D.",
      "rank": "OIC",
      "working_rank": "OIC",
      "shift_type": "Night",
      "in_time": "19:00",
      "out_time": "07:00",
      "signature_present": true,
      "confidence": 0.95,
      "other": []
    },
    {
      "row_id": 8,
      "employee_id": "75109",
      "name": "Wittekoon W.M.R.R.K.",
      "rank": "SSO",
      "working_rank": "SSO",
      "shift_type": "Night",
      "in_time": "19:00",
      "out_time": "07:00",
      "signature_present": true,
      "confidence": 0.94,
      "other": []
    },
    {
      "row_id": 9,
      "employee_id": "76306",
      "name": "Kurera B.D.R.",
      "rank": "LSO",
      "working_rank": "LSO",
      "shift_type": "Night",
      "in_time": "19:00",
      "out_time": "07:00",
      "signature_present": true,
      "confidence": 0.94,
      "other": []
    },
    {
      "row_id": 10,
      "employee_id": "73088",
      "name": "Jayathilaka R.M.",
      "rank": "SSO",
      "working_rank": "SSO",
      "shift_type": "Night",
      "in_time": "19:00",
      "out_time": "07:00",
      "signature_present": true,
      "confidence": 0.95,
      "other": []
    },
    {
      "row_id": 11,
      "employee_id": "76096",
      "name": "Karthigeyan P.",
      "rank": "SSO",
      "working_rank": "SSO",
      "shift_type": "Night",
      "in_time": "19:00",
      "out_time": "07:00",
      "signature_present": true,
      "confidence": 0.94,
      "other": []
    }
  ],
  "supervisors": [
    {
      "designation": "OIC",
      "name": null,
      "employee_id": null,
      "signature_present": true,
      "date": null,
      "confidence": 0.93
    }
  ],
  "other": []
}