{
  "image_id": 19,
  "image_file": "19.jpeg",
  "original_filename": "94776219512_20260722_182245_518575_09af94c5.jpeg",
  "document_type": "Daily Attendance Format",
  "confidence": 0.96,
  "date": "2026-07-21",
  "location_number": "8843",
  "location_name": "Deshamanya A.Y.S Gnanam",
  "shift_summary": [
    {
      "shift_name": "Day Shift",
      "scheduled_in_time": "07:00",
      "scheduled_out_time": "19:00"
    },
    {
      "shift_name": "Night Shift",
      "scheduled_in_time": "19:00",
      "scheduled_out_time": "07:00"
    }
  ],
  "attendance_records": [
    {
      "row_id": 1,
      "employee_id": "57173",
      "name": "Maduranga S.H.M.",
      "rank": "SSO",
      "working_rank": "SSO",
      "shift_type": "Day",
      "in_time": "07:00",
      "out_time": "19:00",
      "signature_present": true,
      "confidence": 0.96,
      "other": []
    },
    {
      "row_id": 2,
      "employee_id": "57173",
      "name": "Maduranga S.H.M.",
      "rank": "SSO",
      "working_rank": "SSO",
      "shift_type": "Night",
      "in_time": "19:00",
      "out_time": "07:00",
      "signature_present": true,
      "confidence": 0.96,
      "other": []
    }
  ],
  "supervisors": [
    {
      "designation": "SM/CSO/OIC",
      "name": null,
      "employee_id": null,
      "signature_present": true,
      "date": "2026-07-21",
      "confidence": 0.95
    }
  ],
  "other": []
}