{
  "image_id": 13,
  "image_file": "13.jpeg",
  "original_filename": "94704599305_20260722_154033_135129_f5b10d03.jpeg",
  "document_type": "Handwritten Shift Sheet",
  "confidence": 0.95,
  "date": "2026-07-21",
  "location_number": "7081",
  "location_name": "Hemas Pharmaceutical",
  "shift_summary": [],
  "attendance_records": [
    {
      "row_id": 1,
      "employee_id": "73613",
      "name": "Mahagedara H.B.M.C.B.",
      "rank": "OIC",
      "working_rank": "OIC",
      "shift_type": "Day",
      "in_time": "07:00",
      "out_time": "19:00",
      "signature_present": true,
      "confidence": 0.95,
      "other": []
    },
    {
      "row_id": 2,
      "employee_id": "73613",
      "name": "Mahagedara H.B.M.C.B.",
      "rank": "OIC",
      "working_rank": "OIC",
      "shift_type": "Night",
      "in_time": "19:00",
      "out_time": "07:00",
      "signature_present": true,
      "confidence": 0.95,
      "other": []
    }
  ],
  "supervisors": [
    {
      "designation": "SM/OIC",
      "name": null,
      "employee_id": null,
      "signature_present": true,
      "date": null,
      "confidence": 0.94
    }
  ],
  "other": []
}