{
  "image_id": 9,
  "image_file": "9.jpeg",
  "original_filename": "94774017396_20260722_171858_210099_642f928d.jpeg",
  "document_type": "Handwritten Shift Sheet",
  "confidence": 0.95,
  "date": "2026-07-21",
  "location_number": "7247",
  "location_name": "Saint Sebastiyan",
  "shift_summary": [],
  "attendance_records": [
    {
      "row_id": 1,
      "employee_id": "75765",
      "name": "Sagara Ruwan Priya",
      "rank": "SSO",
      "working_rank": "SSO",
      "shift_type": "Day",
      "in_time": "07:00",
      "out_time": "19:00",
      "signature_present": true,
      "confidence": 0.95,
      "other": []
    },
    {
      "row_id": 2,
      "employee_id": "75765",
      "name": "Sagara Ruwan Priya",
      "rank": "SSO",
      "working_rank": "SSO",
      "shift_type": "Night",
      "in_time": "19:00",
      "out_time": "07:00",
      "signature_present": true,
      "confidence": 0.95,
      "other": []
    }
  ],
  "supervisors": [
    {
      "designation": "SM/CSO/OIC",
      "name": null,
      "employee_id": null,
      "signature_present": true,
      "date": null,
      "confidence": 0.94
    }
  ],
  "other": []
}