{
  "image_id": 15,
  "image_file": "15.jpeg",
  "original_filename": "94740835902_20260722_070220_689462_3ec1134e.jpeg",
  "document_type": "Daily Attendance Format",
  "confidence": 0.95,
  "date": "2026-07-12",
  "location_number": "6241",
  "location_name": "Kurunagala Tokyo Cement",
  "shift_summary": [
    {
      "shift_name": "Day Shift",
      "scheduled_in_time": "07:00",
      "scheduled_out_time": "19:00"
    },
    {
      "shift_name": "Night Shift",
      "scheduled_in_time": "19:00",
      "scheduled_out_time": "07:00"
    }
  ],
  "attendance_records": [
    {
      "row_id": 1,
      "employee_id": "72493",
      "name": "D.M.D. Peramuna",
      "rank": "SSO",
      "working_rank": "SSO",
      "shift_type": "Day",
      "in_time": "07:00",
      "out_time": "19:00",
      "signature_present": true,
      "confidence": 0.96,
      "other": []
    },
    {
      "row_id": 2,
      "employee_id": "72493",
      "name": "D.M.D. Peramuna",
      "rank": "SSO",
      "working_rank": "SSO",
      "shift_type": "Night",
      "in_time": "19:00",
      "out_time": "07:00",
      "signature_present": true,
      "confidence": 0.96,
      "other": []
    }
  ],
  "supervisors": [],
  "other": []
}