{
  "image_id": 2,
  "image_file": "2.jpeg",
  "original_filename": "94740835902_20260722_114200_113177_14fcfbcd.jpeg",
  "document_type": "Daily Attendance Format",
  "confidence": 0.96,
  "date": "2026-07-15",
  "location_number": "7270",
  "location_name": "Tea Board Bandarawela",
  "shift_summary": [
    {
      "shift_name": "Day Shift",
      "scheduled_in_time": "07:00",
      "scheduled_out_time": "19:00"
    },
    {
      "shift_name": "Night Shift",
      "scheduled_in_time": "19:00",
      "scheduled_out_time": "07:00"
    }
  ],
  "attendance_records": [
    {
      "row_id": 1,
      "employee_id": "75387",
      "name": "W.M. Gunarathna",
      "rank": "SSO",
      "working_rank": "SSO",
      "shift_type": "Day",
      "in_time": "07:00",
      "out_time": "19:00",
      "signature_present": true,
      "confidence": 0.97,
      "other": []
    },
    {
      "row_id": 2,
      "employee_id": "75387",
      "name": "W.M. Gunarathna",
      "rank": "SSO",
      "working_rank": "SSO",
      "shift_type": "Night",
      "in_time": "19:00",
      "out_time": "07:00",
      "signature_present": true,
      "confidence": 0.97,
      "other": []
    }
  ],
  "supervisors": [
    {
      "designation": "SSO",
      "name": "W.M. Gunarathna",
      "employee_id": "75387",
      "signature_present": true,
      "date": null,
      "confidence": 0.95
    }
  ],
  "other": []
}